{
  "input_sha256": "c62f0456ce39fcccd85d408b42b7b3f20daf961d10c67efed0ec2bcd7148c49a",
  "model_id": "HELD-04-MODEL",
  "document_version": "1.0",
  "revision_count": 0,
  "status": "completed",
  "needs": [
    {
      "id": "HELD-04-NEED",
      "model_id": "HELD-04-MODEL",
      "situation": "설명서 조건대로 사용",
      "pain": "큰 접시의 방향을 잘못 놓아 회전 날개가 걸려 다시 적재했다.",
      "evidence_ids": [
        "HELD-04-REVIEW"
      ],
      "uncertainties": []
    }
  ],
  "desired_outcomes": [
    {
      "need_id": "HELD-04-NEED",
      "desired_outcome": "해당 사용 상황의 남은 불편을 줄인다"
    }
  ],
  "gaps": [
    {
      "id": "HELD-04-GAP",
      "need_id": "HELD-04-NEED",
      "model_id": "HELD-04-MODEL",
      "feature_ids": [
        "HELD-04-FEATURE"
      ],
      "support_status": "supported",
      "remaining_pain": "큰 접시의 방향을 잘못 놓아 회전 날개가 걸려 다시 적재했다.",
      "evidence_ids": [
        "HELD-04-REVIEW",
        "HELD-04-MANUAL"
      ],
      "questions": []
    }
  ],
  "concepts": [
    {
      "id": "HELD-04-CONCEPT",
      "title": "큰 식기 적재 방향을 사전에 확인하는 안내",
      "kind": "service",
      "gap_ids": [
        "HELD-04-GAP"
      ],
      "evidence_ids": [
        "HELD-04-REVIEW",
        "HELD-04-MANUAL"
      ],
      "differentiation": "기존 기능의 사용 조건 이후에도 남는 불편을 다룬다",
      "requirements": [
        "해당 사용 조건에서 불편 감소 여부를 검토할 수 있어야 한다"
      ],
      "assumptions": [
        "실제 사용자 검증은 아직 수행하지 않았다"
      ],
      "status": "proposed"
    }
  ],
  "review_assessments": [
    {
      "evidence_id": "HELD-04-REVIEW",
      "polarity": "complaint",
      "reason": "큰 접시의 방향을 잘못 놓아 회전 날개가 걸려 다시 적재했다."
    },
    {
      "evidence_id": "HELD-CONTRARY",
      "polarity": "conflicting",
      "reason": "같은 조건의 불편 주장과 상충한다"
    }
  ],
  "gap_assessments": [
    {
      "gap_id": "HELD-04-GAP",
      "support_basis": "explicit_supported",
      "resolution": "remaining",
      "reason": "기능은 있으나 사용 조건에 남는 불편이 있다"
    }
  ],
  "concept_assessments": [
    {
      "concept_id": "HELD-04-CONCEPT",
      "duplication": "distinct",
      "compared_feature_ids": [
        "HELD-04-FEATURE"
      ],
      "reason": "기능과 남은 불편을 구분해 제안한 검토용 후보"
    }
  ],
  "questions": [],
  "hold_reasons": [],
  "unresolved": [],
  "no_candidate_reasons": []
}
