{
  "input_sha256": "ec6fad04878b817ac9aac15acb281eec2ea98b8bddad9954d7a06dbef9af68c4",
  "model_id": "HELD-06-MODEL",
  "document_version": "1.0",
  "revision_count": 0,
  "status": "completed",
  "needs": [
    {
      "id": "HELD-06-NEED",
      "model_id": "HELD-06-MODEL",
      "situation": "설명서 조건대로 사용",
      "pain": "도어 포켓 뒤쪽의 작은 병이 보이지 않아 같은 음료를 중복 구매했다.",
      "evidence_ids": [
        "HELD-06-REVIEW"
      ],
      "uncertainties": []
    }
  ],
  "desired_outcomes": [
    {
      "need_id": "HELD-06-NEED",
      "desired_outcome": "해당 사용 상황의 남은 불편을 줄인다"
    }
  ],
  "gaps": [
    {
      "id": "HELD-06-GAP",
      "need_id": "HELD-06-NEED",
      "model_id": "HELD-06-MODEL",
      "feature_ids": [
        "HELD-06-FEATURE"
      ],
      "support_status": "supported",
      "remaining_pain": "도어 포켓 뒤쪽의 작은 병이 보이지 않아 같은 음료를 중복 구매했다.",
      "evidence_ids": [
        "HELD-06-REVIEW",
        "HELD-06-MANUAL"
      ],
      "questions": []
    }
  ],
  "concepts": [
    {
      "id": "HELD-06-CONCEPT",
      "title": "도어 포켓 뒤쪽 보관물을 확인하는 표시",
      "kind": "feature",
      "gap_ids": [
        "HELD-06-GAP"
      ],
      "evidence_ids": [
        "HELD-06-REVIEW",
        "HELD-06-MANUAL"
      ],
      "differentiation": "기존 기능의 사용 조건 이후에도 남는 불편을 다룬다",
      "requirements": [
        "해당 사용 조건에서 불편 감소 여부를 검토할 수 있어야 한다"
      ],
      "assumptions": [
        "실제 사용자 검증은 아직 수행하지 않았다"
      ],
      "status": "proposed"
    }
  ],
  "review_assessments": [
    {
      "evidence_id": "HELD-06-REVIEW",
      "polarity": "complaint",
      "reason": "도어 포켓 뒤쪽의 작은 병이 보이지 않아 같은 음료를 중복 구매했다."
    }
  ],
  "gap_assessments": [
    {
      "gap_id": "HELD-06-GAP",
      "support_basis": "explicit_supported",
      "resolution": "remaining",
      "reason": "기능은 있으나 사용 조건에 남는 불편이 있다"
    }
  ],
  "concept_assessments": [
    {
      "concept_id": "HELD-06-CONCEPT",
      "duplication": "distinct",
      "compared_feature_ids": [
        "HELD-06-FEATURE"
      ],
      "reason": "기능과 남은 불편을 구분해 제안한 검토용 후보"
    }
  ],
  "questions": [],
  "hold_reasons": [],
  "unresolved": [],
  "no_candidate_reasons": []
}
